{
  "schema_version":1,"updated":"2026-08-01","tradition_id":"mesopotamian_babylonian","school_id":"late_babylonian_horoscope_text27_rochberg_1998","source_pack_id":"rochberg_1998_text27_bm38104_v1","source_edition_id":"babylonian_rochberg_horoscopes_1998_text27","source_registry_ids":["babylonian_rochberg_horoscopes_1998_awdl"],"implementation_status":"not_implemented","publication_status":"research_only","evidence_note":"Text 27 (BM 38104), book pages 137-140 / PDF pages 153-156, was inspected in transcription, translation, apparatus, commentary, astronomical table, and rendered pages. Two fortune statements occur on the upper edge, but the edition supplies no protasis or demonstrated link to any recorded placement. They remain record-specific historical fragments with null algorithmic triggers.",
  "rules":[
    {"rule_id":"babylonian.rochberg1998.text27.upper_edge1.good_fortune_fragment","tradition_id":"mesopotamian_babylonian","school_id":"late_babylonian_horoscope_text27_rochberg_1998","period":"seleucid_era_year_243_horoscope_in_1998_critical_edition","domain":"natal","scope":{"work":"Babylonian Horoscopes","text":"Text 27 (BM 38104)","technique":"upper_edge_record_specific_judgment","executable_from_birth_input":false},"conditions":{"all":[{"fact":"source_record","operator":"equals","value":"rochberg1998.text27"},{"fact":"judgment.protasis","operator":"unresolved"}]},"conclusion":{"type":"damaged_historical_judgment","themes":["good_fortune"],"algorithmic_trigger":null,"customer_prediction":false},"priority":null,"exceptions":["The phrase is damaged after 'That child good fortune'.","No planet, sign, degree, eclipse, seasonal hour, or visibility datum is textually established as its trigger.","It may be part of a two-line temporal sequence, but the relationship is not explicit enough to execute."],"conflicts_with":["generic_text27_good_fortune_chart_rule"],"source_passages":[{"edition_id":"babylonian_rochberg_horoscopes_1998_awdl","work":"Babylonian Horoscopes","section":"Text 27 (BM 38104)","location":"p. 139, upper edge line 1","verification":"transcription_translation_apparatus_commentary_table_and_page_images_inspected"}],"evidence_grade":"C","publication_limit":"Corpus-fragment display only. Do not generate a personal promise of good fortune.","review_status":"protasis_assyriological_layout_and_parallel_text_review_pending"},
    {"rule_id":"babylonian.rochberg1998.text27.upper_edge2.good_fortune_diminishes","tradition_id":"mesopotamian_babylonian","school_id":"late_babylonian_horoscope_text27_rochberg_1998","period":"seleucid_era_year_243_horoscope_in_1998_critical_edition","domain":"natal","scope":{"work":"Babylonian Horoscopes","text":"Text 27 (BM 38104)","technique":"upper_edge_record_specific_judgment","executable_from_birth_input":false},"conditions":{"all":[{"fact":"source_record","operator":"equals","value":"rochberg1998.text27"},{"fact":"judgment.protasis","operator":"unresolved"},{"fact":"sequence_relationship_to_upper_edge1","operator":"unresolved"}]},"conclusion":{"type":"partly_preserved_historical_judgment","themes":["good_fortune_will_diminish"],"algorithmic_trigger":null,"customer_prediction":false},"priority":null,"exceptions":["The trigger and timing mechanism are absent.","Adjacency to the preceding damaged line is not proof of a complete two-stage life-course rule.","The statement must not become a deterministic decline forecast."],"conflicts_with":["generic_text27_fortune_decline_rule","life_course_decline_prediction"],"source_passages":[{"edition_id":"babylonian_rochberg_horoscopes_1998_awdl","work":"Babylonian Horoscopes","section":"Text 27 (BM 38104)","location":"p. 139, upper edge line 2","verification":"transcription_translation_apparatus_commentary_table_and_page_images_inspected"}],"evidence_grade":"C","publication_limit":"Corpus-fragment display only. Do not generate a personal forecast of declining fortune.","review_status":"protasis_sequence_assyriological_and_parallel_text_review_pending"}
  ]
}
